Path,Caption,GT
LM_video/IR/user16/2-1-2/IR.mp4,"The user calmly takes a cup from the drawer, steadily pours the drink, and evenly stirs with a spoon.","opening storage container,pouring,stirring,grabbing utensils"
LM_video/IR/user16/2-1-3/IR.mp4,"The user eagerly takes a cup from the drawer, quickly pours the drink, and hurriedly stirs with a spoon.","opening storage container,pouring,stirring,grabbing utensils"
LM_video/IR/user16/2-2-1/IR.mp4,The user slowly dries her hands and elegantly combs her hair with a comb.,"wiping hands,combing hair"
LM_video/IR/user16/2-2-2/IR.mp4,The user carefully dries her hands and seriously combs her hair with a comb.,"wiping hands,combing hair"
LM_video/IR/user16/2-2-3/IR.mp4,The user quickly dries her hands and hastily combs her hair with a comb.,"wiping hands,combing hair"
LM_video/IR/user16/2-3-1/IR.mp4,"Then, the user slowly returns to the kitchen, patiently peels an apple with a fruit knife, preparing to enjoy it slowly.","walking,grabbing utensils,peeling fruit"
LM_video/IR/user16/2-3-2/IR.mp4,"Then, the user calmly returns to the kitchen, carefully peels an apple with a fruit knife, preparing to enjoy it in peace.","walking,grabbing utensils,peeling fruit"
LM_video/IR/user16/2-3-3/IR.mp4,"Then, the user hurriedly returns to the kitchen, quickly peels an apple with a fruit knife, preparing to eat it immediately.","walking,grabbing utensils,peeling fruit"
LM_video/IR/user16/3-1-1/IR.mp4,"The user slowly sweeps the floor, gently gathering the dust and debris into a pile. Afterwards, she stands up and leisurely begins to do squats to exercise. Then, she walks to the center of the living room and uses a mop to carefully mop the floor, ensuring that it is clean and spotless.","sweeping,standing up,squats,walking,mopping"
LM_video/IR/user16/3-1-2/IR.mp4,"The user steadily sweeps the floor, orderly gathering the dust and debris into a pile. Afterwards, she stands up and calmly begins to do squats to exercise. Then, she walks to the center of the living room and uses a mop to seriously mop the floor, ensuring that it is clean and spotless.","sweeping,standing up,squats,walking,mopping"
LM_video/IR/user16/3-1-3/IR.mp4,"The user quickly sweeps the floor, rapidly gathering the dust and debris into a pile. Afterwards, she stands up and hurriedly begins to do squats to exercise. Then, she walks to the center of the living room and uses a mop to frantically mop the floor, ensuring that it is clean and spotless.","sweeping,standing up,squats,walking,mopping"
LM_video/IR/user16/3-2-1/IR.mp4,"The user patiently wipes every dish and utensil at the sink. Afterwards, she slowly drinks water and gently peels fruit to enjoy.","washing dishes,peeling fruit"
LM_video/IR/user16/3-2-2/IR.mp4,"The user attentively wipes every dish and utensil at the sink. Afterwards, she quietly drinks water and naturally peels fruit to enjoy.","washing dishes,peeling fruit"
LM_video/IR/user16/3-2-3/IR.mp4,"The user nervously wipes every dish and utensil at the sink. Afterwards, she anxiously drinks water and quickly peels fruit to enjoy.","washing dishes,peeling fruit"
LM_video/IR/user16/3-3-1/IR.mp4,"Finally, the user returns to the living room and uses a cloth to carefully wipe the table, wiping away the stains and dust.","walking,wiping surfaces"
LM_video/IR/user16/3-3-2/IR.mp4,"Finally, the user returns to the living room and uses a cloth to meticulously wipe the table, wiping away the stains and dust.","walking,wiping surfaces"
LM_video/IR/user16/3-3-3/IR.mp4,"Finally, the user returns to the living room and uses a cloth to quickly clean the table, wiping away the stains and dust.","walking,wiping surfaces"
LM_video/IR/user16/4-1-1/IR.mp4,"The user sits leisurely on the chair in the bedroom, gently tapping the keyboard to write an article, occasionally glancing at the time to keep track. Midway, she puts on headphones and slowly listens to music to relax, then makes a call, casually discussing the article structure with the editor. After the call, she stands up, jogs in place for a few minutes to stretch, and then sits down again to continue flipping through documents, refining the content.","typing on a keyboard,writing,checking the time,listen to music with headphones,calling,standing up,running,sitting down,reading,turning a page"
LM_video/IR/user16/4-1-2/IR.mp4,"The user sits calmly on the chair in the bedroom, focused on typing to write an article, occasionally checking the time to keep track. Midway, she puts on headphones and quietly listens to music to relax, then makes a call, calmly discussing the article structure with the editor. After the call, she stands up, jogs in place for a few minutes in a composed manner, and then sits down to continue flipping through documents, refining the content.","typing on a keyboard,writing,checking the time,listen to music with headphones,calling,standing up,running,sitting down,reading,turning a page"
LM_video/IR/user16/4-1-3/IR.mp4,"The user sits anxiously on the chair in the bedroom, typing rapidly to write an article, frequently checking the time to stay on track. Midway, she hurriedly puts on headphones and quickly listens to music to relax, then makes a call, nervously discussing the article structure with the editor. After the call, she stands up, jogs in place quickly for a few minutes, and then sits down to continue flipping through documents, refining the content.","typing on a keyboard,writing,checking the time,listen to music with headphones,calling,standing up,running,sitting down,reading,turning a page"
LM_video/IR/user16/5-1-1/IR.mp4,"The user lazily leans on the sofa, gently swiping her finger across the screen, with soft music playing through her headphones.","using mobile phone,listen to music with headphones"
LM_video/IR/user16/5-1-2/IR.mp4,"The user quietly sits on the sofa, gently swiping her finger across the screen, with soft music playing through her headphones.","sitting down,using mobile phone,listen to music with headphones"
LM_video/IR/user16/5-1-3/IR.mp4,"The user impatiently sits on the sofa, gently swiping her finger across the screen, with soft music playing through her headphones.","sitting down,using mobile phone,listen to music with headphones"
LM_video/IR/user16/5-2-1/IR.mp4,"The user slowly walks to the kitchen, carefully peels fruit, patiently separates the skin, and savors the sweetness of each bite.","walking,peeling fruit,eating"
LM_video/IR/user16/5-2-2/IR.mp4,"The user steadily walks to the kitchen, skillfully peels fruit, carefully removes the skin, and enjoys the refreshing taste of each bite.","walking,peeling fruit,eating"
LM_video/IR/user16/5-2-3/IR.mp4,"The user quickly walks to the kitchen, hastily peels fruit, quickly removes the skin, and devours each sweet bite.","walking,peeling fruit,eating"
LM_video/IR/user16/5-3-1/IR.mp4,"After returning to the living room, the user slowly lifts one leg, smoothly practicing balance by standing on one leg, then walks to the sofa and quickly lies down, her movements smooth and relaxed. After exercising, she sits on the sofa, slowly picks up a cup, and takes a sip, then continues to immerse herself in gaming, occasionally calmly checking her watch.","walking,one leg balance,walking,lying down,sitting down,drinking,playing games,checking the time"
LM_video/IR/user16/5-3-2/IR.mp4,"After returning to the living room, the user steadily lifts one leg, steadily practicing balance by standing on one leg, then walks to the sofa and gently lies down, her movements coordinated and natural. After exercising, she sits on the sofa, calmly picks up a cup, and takes a sip, then continues to focus on gaming, occasionally calmly checking her watch.","walking,one leg balance,walking,lying down,sitting down,drinking,playing games,checking the time"
LM_video/IR/user16/5-3-3/IR.mp4,"After returning to the living room, the user hastily lifts one leg, unstably practicing balance by standing on one leg, then walks to the sofa and violently lies down, her movements rushed and nervous. After exercising, she sits on the sofa, impatiently picks up a cup, and takes a gulp, then continues to focus on gaming, occasionally anxiously checking her watch.","walking,one leg balance,walking,lying down,sitting down,drinking,playing games,checking the time"
LM_video/IR/user16/6-1-1/IR.mp4,"The user easily completes jumping jacks in the living room, then walks to the sofa and lies down, leisurely doing lunges by the wall.","jumping jacks,lying down,lunges"
LM_video/IR/user16/6-1-2/IR.mp4,"The user quickly completes jumping jacks in the living room, then walks to the sofa and lies down, eagerly doing lunges by the wall.","jumping jacks,lying down,lunges"
LM_video/IR/user16/6-1-3/IR.mp4,"The user steadily completes jumping jacks in the living room, then walks to the sofa and lies down, calmly doing lunges by the wall.","jumping jacks,lying down,lunges"
LM_video/IR/user16/6-2-1/IR.mp4,"The user calmly measures her body temperature and takes medicine, casually checks the time on her phone. She slowly sweeps the floor, meticulously wipes the window, methodically cleans up the surroundings, and finally slowly eats and drinks using utensils.","measure body temperature,taking medicine,checking the time,using mobile phone,sweeping,wiping surfaces,eating,drinking,grabbing utensils"
LM_video/IR/user16/6-2-2/IR.mp4,"The user hurriedly measures her body temperature and takes medicine, quickly checks the time on her phone. She impatiently sweeps the floor, hastily wipes the window, messily cleans up the surroundings, and finally hurriedly eats and drinks using utensils.","measure body temperature,taking medicine,checking the time,using mobile phone,sweeping,wiping surfaces,eating,drinking,grabbing utensils"
LM_video/IR/user16/6-2-3/IR.mp4,"The user carefully measures her body temperature and takes medicine, seriously checks the time on her phone. She orderly sweeps the floor, carefully wipes the window, neatly cleans up the surroundings, and finally calmly eats and drinks using utensils.","measure body temperature,taking medicine,checking the time,using mobile phone,sweeping,wiping surfaces,eating,drinking,grabbing utensils"
LM_video/IR/user16/7-1-1/IR.mp4,"The user slowly sits down on the bedroom chair, gently massaging her calf muscles with a soothing and rhythmic motion, a relaxed smile on her face.","sitting down,massaging oneself"
LM_video/IR/user16/7-1-2/IR.mp4,"The user steadily sits down on the bedroom chair, pressing evenly on her calf muscles, massaging seriously with steady and firm movements, with a calm expression.","sitting down,massaging oneself"
LM_video/IR/user16/7-1-3/IR.mp4,"The user hurriedly sits down on the bedroom chair, quickly pressing on her calf muscles, massaging hastily and a bit roughly, with furrowed brows.","sitting down,massaging oneself"
LM_video/IR/user16/7-2-1/IR.mp4,"The user gently pours a drink, slowly stirs, with smooth and composed motions, then gracefully uses utensils to taste the food.","pouring,stirring,grabbing utensils,eating"
LM_video/IR/user16/7-2-2/IR.mp4,"The user steadily pours a drink, stirs evenly, with simple and effective movements, then neatly eats using utensils.","pouring,stirring,grabbing utensils,eating"
LM_video/IR/user16/7-2-3/IR.mp4,"The user hurriedly pours a drink, stirs quickly, with fast and somewhat messy movements, then eats in a rush using utensils.","pouring,stirring,grabbing utensils,eating"
LM_video/IR/user16/7-3-1/IR.mp4,"The user quietly returns to the bedroom, gently checks the time, and sits on the chair, slowly flipping through documents, with a peaceful and focused expression.","walking,checking the time,sitting down,reading,turning a page"
LM_video/IR/user16/7-3-2/IR.mp4,"The user steadily returns to the bedroom, carefully checks the time, and sits on the chair, methodically flipping through documents, looking composed and focused.","walking,checking the time,sitting down,reading,turning a page"
LM_video/IR/user16/7-3-3/IR.mp4,"The user quickly returns to the bedroom, checks the time anxiously, and sits on the chair, rapidly flipping through documents, appearing tense and worried.","walking,checking the time,sitting down,reading,turning a page"
LM_video/IR/user17/1-1-1/IR.mp4,"The user gently brushes her teeth while standing, dries her hands with a towel, then slowly picks up a comb and meticulously combs her hair before changing into comfortable clothes.","brushing teeth,wiping hands,combing hair,getting dressed"
LM_video/IR/user17/1-1-2/IR.mp4,"The user efficiently brushes her teeth while standing, dries her hands with a towel, then steadily picks up a comb and methodically combs her hair before changing into neat clothes.","brushing teeth,wiping hands,combing hair,getting dressed"
LM_video/IR/user17/1-1-3/IR.mp4,"The user quickly brushes her teeth while standing, dries her hands with a towel, then hastily picks up a comb and rapidly combs her hair before changing into comfortable clothes.","brushing teeth,wiping hands,combing hair,getting dressed"
LM_video/IR/user17/1-2-1/IR.mp4,"The user walks slowly to the living room, sits on the sofa, leisurely pours a drink, gracefully uses utensils to enjoy breakfast, occasionally glances at the clock, and finally picks up the phone calmly to take a selfie.","walking,sitting down,pouring,grabbing utensils,eating,checking the time,using mobile phone,taking a selfie"
LM_video/IR/user17/1-2-2/IR.mp4,"The user walks quickly to the living room, sits on the sofa, hurriedly pours a drink, eagerly uses utensils to finish breakfast, frequently checks the time, and finally grabs the phone hurriedly to take a selfie.","walking,sitting down,pouring,grabbing utensils,eating,checking the time,using mobile phone,taking a selfie"
LM_video/IR/user17/1-2-3/IR.mp4,"The user walks steadily to the living room, sits on the sofa, calmly pours a drink, quietly uses utensils to enjoy breakfast, occasionally looks at the clock, and finally picks up the phone serenely to take a selfie.","walking,sitting down,pouring,grabbing utensils,eating,checking the time,using mobile phone,taking a selfie"
LM_video/IR/user17/2-1-1/IR.mp4,"The user leisurely takes out a bowl and spoon from the drawer, gently opening the refrigerator door and slowly retrieves the yogurt. She serenely pours the yogurt into the bowl, then stirs it gently with the spoon.","grabbing utensils,opening storage container,pouring,stirring"
LM_video/IR/user17/2-1-2/IR.mp4,"The user calmly takes out a bowl and spoon from the drawer, steadily opening the refrigerator door and easily retrieves the yogurt. She smoothly pours the yogurt into the bowl, then stirs it evenly with the spoon.","grabbing utensils,opening storage container,pouring,stirring"
LM_video/IR/user17/2-1-3/IR.mp4,"The user hastily takes out a bowl and spoon from the drawer, quickly opening the refrigerator door and hurriedly retrieves the yogurt. She rapidly pours the yogurt into the bowl, then stirs it vigorously with the spoon.","grabbing utensils,opening storage container,pouring,stirring"
LM_video/IR/user17/2-2-1/IR.mp4,"After finishing stirring the drink, the user slowly lies down in the living room, then begins to do jumping jacks with smooth and composed movements. Afterwards, she carefully wipes the table, sits down, and slowly enjoys some yogurt.","stirring,lying down,jumping jacks,wiping surfaces,sitting down,eating"
LM_video/IR/user17/2-2-2/IR.mp4,"After finishing stirring the drink, the user lies down steadily in the living room, then begins to do jumping jacks with steady and orderly movements. Afterwards, she diligently wipes the table, sits down, and quietly enjoys some yogurt.","stirring,lying down,jumping jacks,wiping surfaces,sitting down,eating"
LM_video/IR/user17/2-2-3/IR.mp4,"After finishing stirring the drink, the user rapidly lies down in the living room, then begins to do jumping jacks with rapid and forceful movements. Afterwards, she hurriedly wipes the table, sits down, and eagerly enjoys some yogurt.","stirring,lying down,jumping jacks,wiping surfaces,sitting down,eating"
LM_video/IR/user17/3-1-1/IR.mp4,"The user slowly sweeps the floor in the living room, gently gathering dust and debris into a pile. Afterwards, she leisurely mops the floor, making sure it is spotless. After cleaning, she leisurely jogs in place, gradually raising her heart rate, followed by stretching exercises to loosen up.","sweeping,mopping,running,stretching"
LM_video/IR/user17/3-1-2/IR.mp4,"The user sweeps the floor in the living room, smoothly gathering dust and debris into a pile. Afterwards, she steadily mops the floor, ensuring it is clean and shiny. After cleaning, she jogs in place steadily, gradually increasing her heart rate, then performs stretching exercises to ease her muscles.","sweeping,mopping,running,stretching"
LM_video/IR/user17/3-1-3/IR.mp4,"The user quickly sweeps the floor in the living room, eagerly gathering dust and debris together. Afterwards, she hastily mops the floor, making sure it is spotless. After finishing, she jogs in place rapidly, quickly raising her heart rate, then proceeds to stretching exercises to loosen up.","sweeping,mopping,running,stretching"
LM_video/IR/user17/3-2-1/IR.mp4,"After exercising, the user walks slowly to the kitchen, stands by the sink, and slowly dries each dish and utensil. Then she leisurely eats with utensils, enjoying the food.","washing dishes,grabbing utensils,eating"
LM_video/IR/user17/3-2-2/IR.mp4,"After exercising, the user walks steadily to the kitchen, stands by the sink, and steadily dries each dish and utensil. Then she smoothly eats with utensils, enjoying the food.","washing dishes,grabbing utensils,eating"
LM_video/IR/user17/3-2-3/IR.mp4,"After exercising, the user walks hurriedly to the kitchen, stands by the sink, and hastily dries dishes and utensils. Then she quickly eats with utensils, enjoying the food.","washing dishes,grabbing utensils,eating"
LM_video/IR/user17/3-3-1/IR.mp4,"The user finally returns to the living room, gently wiping the table with a cloth, cleaning off stains and dust from the surface.","walking,wiping surfaces"
LM_video/IR/user17/3-3-2/IR.mp4,"The user finally returns to the living room, steadily wiping the table with a cloth, cleaning off stains and dust from the surface.","walking,wiping surfaces"
LM_video/IR/user17/3-3-3/IR.mp4,"The user finally returns to the living room, hastily wiping the table with a cloth, cleaning off stains and dust from the surface.","walking,wiping surfaces"
LM_video/IR/user17/4-1-1/IR.mp4,"The user slowly walks into the bedroom, gently sits down, unhurriedly opens the computer, and leisurely processes work emails, occasionally checking the time. She then takes out a file and reads it carefully, nodding occasionally. Later, she stretches and slowly squats, relaxing her muscles, then stands up and calmly takes her temperature, making sure she is healthy. Finally, she takes medicine and continues to attentively work.","walking,sitting down,typing on a keyboard,checking the time,reading,stretching,squats,standing up,measure body temperature,taking medicine"
LM_video/IR/user17/4-1-2/IR.mp4,"The user steadily walks into the bedroom, promptly sits down, efficiently opens the computer, and attentively processes work emails, occasionally checking the time. She then takes out a file and quickly reads it, frowning occasionally. Later, she stretches and quickly squats, relaxing her muscles, then stands up and promptly takes her temperature, making sure she is healthy. Finally, she takes medicine and continues to efficiently work.","walking,sitting down,typing on a keyboard,checking the time,reading,stretching,squats,standing up,measure body temperature,taking medicine"
LM_video/IR/user17/4-1-3/IR.mp4,"The user hurriedly walks into the bedroom, abruptly sits down, frantically opens the computer, and anxiously processes work emails, frequently checking the time. She then takes out a file and hurriedly reads it, sighing occasionally. Later, she stretches and rapidly squats, relaxing her muscles, then stands up and hastily takes her temperature, making sure she is healthy. Finally, she takes medicine and continues to frantically work.","walking,sitting down,typing on a keyboard,checking the time,reading,stretching,squats,standing up,measure body temperature,taking medicine"
LM_video/IR/user17/5-1-1/IR.mp4,"The user slowly switches channels and carefully watches TV, then gently undresses.","watching TV,undressing"
LM_video/IR/user17/5-1-2/IR.mp4,"The user attentively switches channels and watches TV with focus, then calmly undresses.","watching TV,undressing"
LM_video/IR/user17/5-1-3/IR.mp4,"The user impatiently switches channels, hastily watches TV, and then hurriedly undresses.","watching TV,undressing"
LM_video/IR/user17/5-2-1/IR.mp4,"Then she walks casually to the kitchen, gently pours a drink, stirs slowly with a spoon, and carefully takes a sip.","pouring,stirring,eating"
LM_video/IR/user17/5-2-2/IR.mp4,"Then she walks steadily to the kitchen, smoothly pours a drink, stirs evenly with a spoon, and constantly takes a sip.","pouring,stirring,eating"
LM_video/IR/user17/5-2-3/IR.mp4,"Then she walks hurriedly to the kitchen, quickly pours a drink, stirs vigorously with a spoon, and hurriedly takes a sip.","pouring,stirring,eating"
LM_video/IR/user17/5-3-1/IR.mp4,"After returning to the living room, the user quietly sits down at the table and gracefully uses utensils to enjoy the pre-prepared fruit. Finally, she unhurriedly disposes of the peels into the trash can.","walking,sitting down,grabbing utensils,eating,throwing"
LM_video/IR/user17/5-3-2/IR.mp4,"After returning to the living room, the user comfortably sits at the table, skillfully using utensils to enjoy pre-prepared fruit. Finally, she neatly disposes of the peels into the trash can.","walking,sitting down,grabbing utensils,eating,throwing"
LM_video/IR/user17/5-3-3/IR.mp4,"After returning to the living room, the user anxiously sits at the table, hastily using utensils to eat pre-prepared fruit. Finally, she quickly discards the peel, throwing it into the trash bin.","walking,sitting down,grabbing utensils,eating,throwing"
LM_video/IR/user17/6-1-1/IR.mp4,"She slowly walks to the bedroom, orderly removes her clothes, changes into casual clothes, then neatly folds the workout clothes.","walking,undressing,getting dressed,folding clothes"
LM_video/IR/user17/6-1-2/IR.mp4,"She steadily walks to the bedroom, naturally removes her clothes, changes into casual clothes, then naturally folds the workout clothes.","walking,undressing,getting dressed,folding clothes"
LM_video/IR/user17/6-1-3/IR.mp4,"She quickly walks to the bedroom, hastily removes her clothes, changes into casual clothes, then hurriedly folds the workout clothes.","walking,undressing,getting dressed,folding clothes"
LM_video/IR/user17/6-2-1/IR.mp4,"Then the user attentively does single-leg balance exercises by the bed, leisurely listening to music with headphones.","one leg balance,listen to music with headphones"
LM_video/IR/user17/6-2-2/IR.mp4,"Then the user steadily does single-leg balance exercises by the bed, happily listening to music with headphones.","one leg balance,listen to music with headphones"
LM_video/IR/user17/6-2-3/IR.mp4,"Then the user hurriedly does single-leg balance exercises by the bed, tensely listening to music with headphones.","one leg balance,listen to music with headphones"
LM_video/IR/user17/6-3-1/IR.mp4,"Afterward, the user returns to the living room, sitting quietly at the table, gently typing on the keyboard, occasionally pausing to calmly check the time.","walking,sitting down,typing on a keyboard,checking the time"
LM_video/IR/user17/6-3-2/IR.mp4,"Afterward, the user returns to the living room, sitting peacefully at the table, smoothly typing on the keyboard, occasionally pausing to serenely check the time.","walking,sitting down,typing on a keyboard,checking the time"
LM_video/IR/user17/6-3-3/IR.mp4,"Afterward, the user returns to the living room, sitting hurriedly at the table, rapidly typing on the keyboard, occasionally pausing to nervously check the time.","walking,sitting down,typing on a keyboard,checking the time"
LM_video/IR/user17/7-1-1/IR.mp4,"The user slowly opens the bedside drawer, carefully takes out a thermometer, attentively takes her temperature, then gently sits on the bedroom chair, quietly puts on headphones, and peacefully listens to music to deeply relax.","opening storage container,measure body temperature,sitting down,listen to music with headphones"
LM_video/IR/user17/7-1-2/IR.mp4,"The user calmly opens the bedside drawer, easily takes out a thermometer, quickly takes her temperature, then sits naturally on the bedroom chair, casually puts on headphones, and comfortably listens to music to calmly relax.","opening storage container,measure body temperature,sitting down,listen to music with headphones"
LM_video/IR/user17/7-1-3/IR.mp4,"The user quickly opens the bedside drawer, hurriedly grabs a thermometer, hastily takes her temperature, then sits anxiously on the bedroom chair, hurriedly puts on headphones, and tensely listens to music, trying to briefly relax.","opening storage container,measure body temperature,sitting down,listen to music with headphones"
LM_video/IR/user17/7-2-1/IR.mp4,"In the kitchen, the user carefully peels fruit, thoroughly dries her hands, preparing to slowly enjoy the fresh fruit.","peeling fruit,wiping hands,eating"
LM_video/IR/user17/7-2-2/IR.mp4,"In the kitchen, the user efficiently peels fruit, neatly dries her hands, preparing to happily enjoy the fresh fruit.","peeling fruit,wiping hands,eating"
LM_video/IR/user17/7-2-3/IR.mp4,"In the kitchen, the user hastily peels fruit, quickly dries her hands, preparing to rapidly eat the fresh fruit.","peeling fruit,wiping hands,eating"
