Path,Caption,GT
LM_video/IR/user21/7-1-3/IR.mp4,"The user calmly picks up the water cup, slowly takes a sip of water, then steadily picks up the utensils, and quietly enjoys breakfast. After finishing the meal, he composedly takes out the medicine, steadily swallows it, and gently massages his shoulder to relieve muscle tension.","drinking, grabbing utensils, eating, taking medicine, massaging oneself"
LM_video/IR/user21/7-2-1/IR.mp4,"The user slowly dries his hands, then slowly massages himself to relax the muscles.","wiping hands, massaging oneself"
LM_video/IR/user21/7-2-2/IR.mp4,"The user hurriedly dries his hands, then quickly massages himself to relax the muscles.","wiping hands, massaging oneself"
LM_video/IR/user21/7-2-3/IR.mp4,"The user gently dries his hands, then softly massages himself to relax the muscles.","wiping hands, massaging oneself"
LM_video/IR/user22/1-1-1/IR.mp4,"The user slowly squeezes out toothpaste, gently brushing his teeth, then leisurely washes his face, and softly dries his hands with a towel.","brushing teeth, washing face, drying hands"
LM_video/IR/user22/1-1-2/IR.mp4,"The user steadily squeezes out toothpaste, carefully brushing his teeth, then attentively washes his face, and carefully dries his hands with a towel.","brushing teeth, washing face, drying hands"
LM_video/IR/user22/1-1-3/IR.mp4,"The user quickly squeezes out toothpaste, hurriedly brushing his teeth, then rapidly washes his face, and quickly dries his hands with a towel.","brushing teeth, washing face, drying hands"
LM_video/IR/user22/1-2-1/IR.mp4,"Back in the bedroom, the user quietly sits on the edge of the bed, slowly combs his hair, then puts on headphones and leisurely listens to music, gently typing on the keyboard, carefully reviewing the document content.","walking, sitting down, combing hair, listen to music with headphones, typing on a keyboard, reading"
LM_video/IR/user22/1-2-2/IR.mp4,"Back in the bedroom, the user calmly sits on the edge of the bed, carefully combs his hair, then puts on headphones and attentively listens to music, steadily typing on the keyboard, seriously reviewing the document content.","walking, sitting down, combing hair, listen to music with headphones, typing on a keyboard, reading"
LM_video/IR/user22/1-2-3/IR.mp4,"Back in the bedroom, the user anxiously sits on the edge of the bed, quickly combs his hair, then puts on headphones and hurriedly listens to music, rapidly typing on the keyboard, anxiously reviewing the document content.","walking, sitting down, combing hair, listen to music with headphones, typing on a keyboard, reading"
LM_video/IR/user22/2-1-1/IR.mp4,"The user slowly walks into the kitchen, gently opens the cabinet, carefully takes out a bottle of juice, and slowly pours it into a glass. Then, he slowly opens the cupboard, gently takes out a set of utensils, meticulously prepares breakfast, occasionally sipping the juice while eating. After the meal, he carefully wipes the dishes and gently wipes the table.","walking, opening cabinet, pouring drink, taking utensils, drinking water, wiping dishes, wiping surfaces"
LM_video/IR/user22/2-1-2/IR.mp4,"The user calmly walks into the kitchen, smoothly opens the cabinet, casually takes out a bottle of juice, and smoothly pours it into a glass. Then, he steadily opens the cupboard, casually takes out a set of utensils, orderly prepares breakfast, occasionally drinking a few sips of juice while eating. After the meal, he briskly wipes the dishes and steadily wipes the table.","walking, opening cabinet, pouring drink, taking utensils, drinking water, wiping dishes, wiping surfaces"
LM_video/IR/user22/2-1-3/IR.mp4,"The user quickly walks into the kitchen, rapidly opens the cabinet, hurriedly takes out a bottle of juice, and quickly pours it into a glass. Then, he rapidly opens the cupboard, hurriedly takes out a set of utensils, quickly prepares breakfast, rapidly drinking a few sips of juice while eating. After the meal, he quickly wipes the dishes and hurriedly wipes the table.","walking, opening cabinet, pouring drink, taking utensils, drinking water, wiping dishes, wiping surfaces"
LM_video/IR/user22/2-2-1/IR.mp4,"Then, the user slowly enters the bathroom, gently washes his face, slowly brushes his teeth, carefully combs his hair, and finally calmly dresses to prepare for the day’s activities.","walking, washing face, brushing teeth, combing hair, dressing"
LM_video/IR/user22/2-2-2/IR.mp4,"Then, the user calmly enters the bathroom, steadily washes his face, briskly brushes his teeth, smoothly combs his hair, and finally steadily dresses to prepare for the day’s activities.","walking, washing face, brushing teeth, combing hair, dressing"
LM_video/IR/user22/2-2-3/IR.mp4,"Then, the user hurriedly enters the bathroom, quickly washes his face, hurriedly brushes his teeth, rapidly combs his hair, and finally hastily dresses to prepare for the day’s activities.","walking, washing face, brushing teeth, combing hair, dressing"
LM_video/IR/user22/3-1-1/IR.mp4,"The user slowly walks into the kitchen, slowly copying the recipe from the phone, then picks up a fruit knife and slowly peels the apple, gently biting into the flesh, as if racing against time.","walking, writing, peeling fruit, eating"
LM_video/IR/user22/3-1-2/IR.mp4,"The user walks into the kitchen at a steady pace, copying the recipe from the phone at a moderate speed, then picks up a fruit knife and peels the apple steadily, carefully biting into the flesh, as if racing against time.","walking, writing, peeling fruit, eating"
LM_video/IR/user22/3-1-3/IR.mp4,"The user quickly walks into the kitchen, rapidly copying the recipe from the phone, then picks up a fruit knife and peels the apple quickly, eagerly biting into the flesh, as if racing against time.","walking, writing, peeling fruit, eating"
LM_video/IR/user22/3-2-1/IR.mp4,"Then, the user leisurely returns to the bedroom, patiently starts folding clothes, neatly folding the garments and gently placing them into the wardrobe. Next, he soothingly does stretches and single-leg balancing in the bedroom, maintaining body flexibility and relaxation.","walking, folding clothes, stretching exercises, one-leg balance"
LM_video/IR/user22/3-2-2/IR.mp4,"Then, the user steadily returns to the bedroom, methodically starts folding clothes, neatly folding the garments and securely placing them into the wardrobe. Next, he calmly does stretches and single-leg balancing in the bedroom, maintaining body coordination and stability.","walking, folding clothes, stretching exercises, one-leg balance"
LM_video/IR/user22/3-2-3/IR.mp4,"Then, the user quickly returns to the bedroom, hurriedly starts folding clothes, hastily folding the garments and rushingly placing them into the wardrobe. Next, he rapidly does stretches and single-leg balancing in the bedroom, maintaining body agility and tension.","walking, folding clothes, stretching exercises, one-leg balance"
LM_video/IR/user22/3-3-1/IR.mp4,"Finally, the user carefully peels the fruit, slowly enjoying eating, savoring the peaceful morning time, and then slowly throws the peel into the trash can.","peeling fruit, eating, throwing"
LM_video/IR/user22/3-3-2/IR.mp4,"Finally, the user neatly peels the fruit, quietly enjoying eating, savoring the calm morning time, and then throws the peel into the trash can at a steady pace.","peeling fruit, eating, throwing"
LM_video/IR/user22/3-3-3/IR.mp4,"Finally, the user quickly peels the fruit, eagerly enjoying eating, experiencing a tense morning time, and then quickly throws the peel into the trash can.","peeling fruit, eating, throwing"
LM_video/IR/user22/4-1-1/IR.mp4,"The user sits beside the sofa, typing intensely on the keyboard. A colleague’s voice comes through the headphones, and he occasionally nods in response. His fingers fly across the keyboard, eyes fixed with determination, occasionally checking the data on the screen with a frown, appearing very anxious. After completing the report, he quickly picks up a document, flips through it rapidly, eyes scanning the text quickly, flipping pages in an urgent manner, clearly eager to obtain information.","typing, talking on the phone, reading a document, flipping pages"
LM_video/IR/user22/4-1-2/IR.mp4,"The user sits beside the sofa, typing steadily on the keyboard. A colleague’s voice comes through the headphones, and he occasionally responds softly. His fingers move at a consistent pace, eyes focused, occasionally checking the data on the screen, wearing a calm expression. After completing the report, he calmly picks up a document, reads it carefully, eyes moving slowly across the text, and flips the pages at a steady pace, appearing organized and unhurried.","typing, talking on the phone, reading a document, flipping pages"
LM_video/IR/user22/4-1-3/IR.mp4,"The user sits beside the sofa, typing leisurely on the keyboard. A colleague’s voice comes through the headphones, and he occasionally responds with a smile. His fingers move lightly across the keyboard, eyes gentle, occasionally checking the data on the screen, looking relaxed. After completing the report, he slowly picks up a document, reads it leisurely, eyes drifting slowly across the text, flipping pages gently, appearing very relaxed.","typing, talking on the phone, reading a document, flipping pages"
LM_video/IR/user22/4-2-1/IR.mp4,"The user walks slowly into the bathroom, gently throws away the trash, then gracefully picks up the phone to take a selfie in the mirror, welcoming the new day.","walking, throwing, taking a selfie"
LM_video/IR/user22/4-2-2/IR.mp4,"The user walks steadily into the bathroom, carefully throws away the trash, then seriously picks up the phone to take a selfie in the mirror, preparing to start the new day.","walking, throwing, taking a selfie"
LM_video/IR/user22/4-2-3/IR.mp4,"The user quickly walks into the bathroom, rapidly throws away the trash, then swiftly picks up the phone to take a selfie in the mirror, eagerly beginning the new day.","walking, throwing, taking a selfie"
LM_video/IR/user22/4-3-1/IR.mp4,"The user sits on the sofa, pours a drink, stirs it quickly, and drinks it hurriedly. Then he picks up a piece of fruit, peels it impatiently, and eats quickly, looking eager.","sitting, pouring a drink, stirring a drink, drinking, peeling fruit, eating"
LM_video/IR/user22/4-3-2/IR.mp4,"The user sits on the sofa, pours a drink, stirs it steadily, and drinks it slowly. Then he picks up a piece of fruit, peels it carefully, and eats slowly, appearing composed.","sitting, pouring a drink, stirring a drink, drinking, peeling fruit, eating"
LM_video/IR/user22/4-3-3/IR.mp4,"The user sits on the sofa, pours a drink, stirs it slowly, and drinks it gently. Then he picks up a piece of fruit, peels it elegantly, and eats slowly, appearing thoroughly relaxed.","sitting, pouring a drink, stirring a drink, drinking, peeling fruit, eating"
LM_video/IR/user22/5-1-1/IR.mp4,"The user slowly measures his temperature, then gently massages himself to relax his muscles.","measuring temperature, massaging oneself"
LM_video/IR/user22/5-1-2/IR.mp4,"The user carefully measures his temperature, then attentively massages himself to relax his muscles.","measuring temperature, massaging oneself"
LM_video/IR/user22/5-1-3/IR.mp4,"The user quickly measures his temperature, then urgently massages himself to relax his muscles.","measuring temperature, massaging oneself"
LM_video/IR/user22/5-2-1/IR.mp4,"The user slowly walks into the living room, sits on the sofa, and continues to attentively browse social media on his phone. The background music blends wonderfully with the quietness of the living room. He slowly peels fruit in the living room, quietly enjoying a moment of peace.","walking, sitting, using phone, peeling fruit"
LM_video/IR/user22/5-2-2/IR.mp4,"The user steadily walks into the living room, sits on the sofa, and continues to seriously browse social media on his phone. The background music blends wonderfully with the quietness of the living room. He carefully peels fruit in the living room, attentively enjoying a moment of peace.","walking, sitting, using phone, peeling fruit"
LM_video/IR/user22/5-2-3/IR.mp4,"The user quickly walks into the living room, sits on the sofa, and continues to tensely browse social media on his phone. The background music blends wonderfully with the quietness of the living room. He hurriedly peels fruit in the living room, tensely enjoying a moment of peace.","walking, sitting, using phone, peeling fruit"
LM_video/IR/user22/6-1-1/IR.mp4,"The user leisurely checks the time, slowly takes off his coat, and calmly puts on his sportswear.","checking time, undressing, dressing"
LM_video/IR/user22/6-1-2/IR.mp4,"The user calmly checks the time, steadily takes off his coat, and smoothly puts on his sportswear.","checking time, undressing, dressing"
LM_video/IR/user22/6-1-3/IR.mp4,"The user anxiously checks the time, quickly takes off his coat, and rapidly puts on his sportswear.","checking time, undressing, dressing"
LM_video/IR/user22/6-2-1/IR.mp4,"The user walks slowly into the living room, performs a few sets of squats leisurely, then slowly sits down on the sofa, sipping water in small gulps to replenish energy. He elegantly uses utensils to eat, then relaxedly does jumping jacks on the spacious floor. Finally, he soothingly does a few sets of stretching exercises, gently wipes his hands after finishing the workout, and tenderly massages himself to relieve muscle tension.","walking, squatting, sitting, drinking water, using utensils, eating, jumping jacks, stretching, wiping hands, massaging oneself"
LM_video/IR/user22/6-2-2/IR.mp4,"The user walks steadily into the living room, performs a few sets of squats with focus, then slowly sits down on the sofa, slowly drinking water to replenish energy. He quietly uses utensils to eat, then steadily does jumping jacks on the spacious floor. Finally, he calmly does a few sets of stretching exercises, carefully wipes his hands after finishing the workout, and moderately massages himself to relieve muscle tension.","walking, squatting, sitting, drinking water, using utensils, eating, jumping jacks, stretching, wiping hands, massaging oneself"
LM_video/IR/user22/6-2-3/IR.mp4,"The user walks quickly into the living room, performs a few sets of squats tensely, then hurriedly sits down on the sofa, gulping water to replenish energy. He hastily uses utensils to eat, then rapidly does jumping jacks on the spacious floor. Finally, he tensely does a few sets of stretching exercises, quickly wipes his hands after finishing the workout, and vigorously massages himself to relieve muscle tension.","walking, squatting, sitting, drinking water, using utensils, eating, jumping jacks, stretching, wiping hands, massaging oneself"
LM_video/IR/user22/7-1-1/IR.mp4,"The user slowly sits down on the sofa, gently picks up the pills on the coffee table, and slowly takes them with a cup of water.","sitting, taking medicine"
LM_video/IR/user22/7-1-2/IR.mp4,"The user calmly sits down on the sofa, calmly picks up the pills on the coffee table, and calmly takes them with a cup of water.","sitting, taking medicine"
LM_video/IR/user22/7-1-3/IR.mp4,"The user anxiously sits down on the sofa, quickly picks up the pills on the coffee table, and rapidly takes them with a cup of water.","sitting, taking medicine"
LM_video/IR/user22/7-2-1/IR.mp4,"Then, the user slowly stands up, gently takes off his coat, slowly changes into lightweight sportswear, and begins jogging in place slowly.","standing, undressing, dressing, jogging in place"
LM_video/IR/user22/7-2-2/IR.mp4,"Then, the user calmly stands up, calmly takes off his coat, calmly changes into lightweight sportswear, and begins jogging in place steadily.","standing, undressing, dressing, jogging in place"
LM_video/IR/user22/7-2-3/IR.mp4,"Then, the user quickly stands up, rapidly takes off his coat, swiftly changes into lightweight sportswear, and begins jogging in place quickly.","standing, undressing, dressing, jogging in place"
LM_video/IR/user22/7-3-1/IR.mp4,"The user sits on the yoga mat and slowly performs stretching exercises, then stands up and slowly performs a one-leg balance.","stretching, standing, one-leg balance"
LM_video/IR/user22/7-3-2/IR.mp4,"The user sits on the yoga mat and evenly performs stretching exercises, then stands up and evenly performs a one-leg balance.","stretching, standing, one-leg balance"
LM_video/IR/user22/7-3-3/IR.mp4,"The user sits on the yoga mat and quickly performs stretching exercises, then stands up and quickly performs a one-leg balance.","stretching, standing, one-leg balance"
LM_video/IR/user23/1-1-1/IR.mp4,"The user stands in front of the sink and slowly brushes her teeth, carefully cleaning each tooth. Then, she gently splashes cold water on her face, and lightly dries her hands with a towel.","brushing teeth, washing face, wiping hands"
LM_video/IR/user23/1-1-2/IR.mp4,"The user stands in front of the sink and quickly brushes her teeth, the motion slightly rushed. Then, she hastily splashes cold water on her face, and quickly dries her hands with a towel.","brushing teeth, washing face, wiping hands"
LM_video/IR/user23/1-1-3/IR.mp4,"The user stands in front of the sink and steadily brushes her teeth, with orderly and unhurried movements. Then, she gently splashes cold water on her face, and steadily dries her hands with a towel.","brushing teeth, washing face, wiping hands"
LM_video/IR/user23/1-2-1/IR.mp4,"The user slowly performs several sets of lunges and squats in the bedroom, with smooth and powerful movements.","lunges, squats"
LM_video/IR/user23/1-2-2/IR.mp4,"The user briskly completes several sets of lunges and squats in the bedroom, with tight and powerful movements.","lunges, squats"
LM_video/IR/user23/1-2-3/IR.mp4,"The user steadily performs several sets of lunges and squats in the bedroom, with strong and balanced movements.","lunges, squats"
LM_video/IR/user23/2-1-1/IR.mp4,"The user leisurely takes bowls and spoons out of the cupboard, then slowly walks to the countertop, picks up a fruit, and begins gently peeling it, with soft and delicate movements, then gracefully throws the peel into the trash can.","opening storage container, peeling fruit, throwing"
LM_video/IR/user23/2-1-2/IR.mp4,"The user calmly takes bowls and spoons out of the cupboard, casually walks to the countertop, picks up a fruit, and begins peeling it at a steady pace, with smooth and orderly motions, then composedly throws the peel into the trash can.","opening storage container, peeling fruit, throwing"
LM_video/IR/user23/2-1-3/IR.mp4,"The user hurriedly takes bowls and spoons out of the cupboard, quickly walks to the countertop, picks up a fruit, and begins peeling it eagerly, with rapid and somewhat flustered movements, then roughly throws the peel into the trash can.","opening storage container, peeling fruit, throwing"
LM_video/IR/user23/2-2-1/IR.mp4,"Afterward, the user walks slowly to the bathroom, slowly combs her hair, then puts down the comb and gently massages herself.","walking, combing hair, massaging oneself"
LM_video/IR/user23/2-2-2/IR.mp4,"Next, the user walks steadily to the bathroom, orderly combs her hair, then puts down the comb and calmly massages herself.","walking, combing hair, massaging oneself"
LM_video/IR/user23/2-2-3/IR.mp4,"Afterward, the user walks quickly to the bathroom, hastily combs her hair, then puts down the comb and roughly massages herself.","walking, combing hair, massaging oneself"
LM_video/IR/user23/2-3-1/IR.mp4,"After finishing, the user slowly walks back to the kitchen, quietly stirs the yogurt, then enjoys it.","walking, stirring, eating"
LM_video/IR/user23/2-3-2/IR.mp4,"After finishing, the user calmly walks back to the kitchen, peacefully stirs the yogurt, then enjoys it.","walking, stirring, eating"
LM_video/IR/user23/2-3-3/IR.mp4,"After finishing, the user hurriedly walks back to the kitchen, hastily stirs the yogurt, then enjoys it.","walking, stirring, eating"
LM_video/IR/user23/3-1-1/IR.mp4,"The user crouches by the bedside table, gently wiping the tabletop with a cloth, carefully ensuring every corner sparkles.",wiping surfaces
LM_video/IR/user23/3-1-2/IR.mp4,"The user crouches by the bedside table, quickly wiping the tabletop with a cloth, attentively making sure every corner sparkles.",wiping surfaces
LM_video/IR/user23/3-1-3/IR.mp4,"The user crouches by the bedside table, calmly wiping the tabletop with a cloth, patiently ensuring every corner sparkles.",wiping surfaces
LM_video/IR/user23/3-2-1/IR.mp4,"The user slowly returns to the living room, starts to carefully sweep the floor, cleaning the dust and debris from the ground. After finishing the cleaning, she decides to exercise a bit, then leisurely jogs in place. After exercising, she comfortably sits down on the sofa, picks up the phone to take a selfie, happily capturing the relaxed moment after the busy time.","walking, sweeping, running, sitting down, taking a selfie"
LM_video/IR/user23/3-2-2/IR.mp4,"The user hurriedly returns to the living room, starts to quickly sweep the floor, cleaning the dust and debris from the ground. After finishing the cleaning, she decides to exercise a bit, then briskly jogs in place. After exercising, she hurriedly sits down on the sofa, picks up the phone to take a selfie, tensely capturing the relaxed moment after the busy time.","walking, sweeping, running, sitting down, taking a selfie"
LM_video/IR/user23/3-2-3/IR.mp4,"The user calmly returns to the living room, starts to orderly sweep the floor, cleaning the dust and debris from the ground. After finishing the cleaning, she decides to exercise a bit, then steadily jogs in place. After exercising, she peacefully sits down on the sofa, picks up the phone to take a selfie, calmly capturing the relaxed moment after the busy time.","walking, sweeping, running, sitting down, taking a selfie"
LM_video/IR/user23/4-1-1/IR.mp4,"In the middle of writing, the user quietly pauses, carefully reading the documents at hand, ensuring the information is accurate.","writing, reading"
LM_video/IR/user23/4-1-2/IR.mp4,"In the middle of writing, the user hurriedly pauses, quickly reading the documents at hand, ensuring the information is accurate.","writing, reading"
LM_video/IR/user23/4-1-3/IR.mp4,"In the middle of writing, the user calmly pauses, thoroughly reading the documents at hand, ensuring the information is accurate.","writing, reading"
LM_video/IR/user23/4-2-1/IR.mp4,"The user walks slowly into the bathroom, picks up her phone and gracefully takes a mirror selfie, then calmly makes a phone call.","walking, taking a selfie, calling"
LM_video/IR/user23/4-2-2/IR.mp4,"The user walks gently into the bathroom, picks up her phone and carefully takes a mirror selfie, then seriously makes a phone call.","walking, taking a selfie, calling"
LM_video/IR/user23/4-2-3/IR.mp4,"The user walks quickly into the bathroom, picks up her phone and quickly takes a mirror selfie, then rapidly makes a phone call.","walking, taking a selfie, calling"
LM_video/IR/user23/4-3-1/IR.mp4,"The user sits on the edge of the bed, slowly and deliberately taking off her clothes, then gracefully stands up and carefully folds the clothes just taken off, before slowly putting on the previously prepared daily outfit.","undressing, folding clothes, getting dressed"
LM_video/IR/user23/4-3-2/IR.mp4,"The user sits on the edge of the bed, unhurriedly taking off her clothes, then calmly stands up and folds the clothes just taken off at a steady pace, before steadily putting on the previously prepared daily outfit.","undressing, folding clothes, getting dressed"
LM_video/IR/user23/4-3-3/IR.mp4,"The user sits on the edge of the bed, quickly slipping out of her clothes, then swiftly stands up and hastily folds the clothes just taken off, before rapidly putting on the previously prepared daily outfit.","undressing, folding clothes, getting dressed"
LM_video/IR/user23/5-1-1/IR.mp4,"The user leisurely sits on the sofa playing mobile games, casually wearing headphones listening to music, occasionally feeling slightly tense due to challenges in the game, excitedly gripping the phone. When the game pauses, she calmly puts down the phone.","playing games, listen to music with headphones"
LM_video/IR/user23/5-1-2/IR.mp4,"The user attentively sits on the sofa playing mobile games, quietly wearing headphones listening to music, sometimes holding her breath tensely due to game challenges, excitedly cheering softly. When the game pauses, she quickly puts down the phone.","playing games, listen to music with headphones"
LM_video/IR/user23/5-1-3/IR.mp4,"The user calmly sits on the sofa playing mobile games, smoothly wearing headphones listening to music, occasionally frowning tensely because of the challenges in the game, excitedly smiling. When the game pauses, she gently puts down the phone.","playing games, listen to music with headphones"
LM_video/IR/user23/5-2-1/IR.mp4,"The user leisurely throws away a piece of trash, slowly takes off her coat, and calmly puts on workout clothes.","throwing, undressing, getting dressed"
LM_video/IR/user23/5-2-2/IR.mp4,"The user calmly throws away a piece of trash, evenly takes off her coat, and steadily puts on workout clothes.","throwing, undressing, getting dressed"
LM_video/IR/user23/5-2-3/IR.mp4,"The user impatiently throws away a piece of trash, quickly takes off her coat, and swiftly puts on workout clothes.","throwing, undressing, getting dressed"
